{
  "taskType": "similar_shape",
  "requestId": "南一_6年級_上學期_第1課_similar_shape_b9402906bd80d389",
  "version": "1.0",
  "source": "chatgpt",
  "input": {
    "publisher": "南一",
    "grade": "6年級",
    "semester": "上學期",
    "lesson": "第1課",
    "targetChar": "垢",
    "lessonChars": [
      "爽",
      "塵",
      "垢",
      "鳳",
      "頁",
      "曝",
      "跡",
      "暈",
      "涉",
      "霾"
    ],
    "count": 6,
    "rule": "以字形相似為主：整體輪廓、共用部件、只差一兩筆、偏旁不同但主體相近。不要以同音或近義為主要依據。",
    "level": "國小中高年級"
  },
  "data": {
    "targetChar": "垢",
    "similarChars": [
      {
        "char": "坵",
        "similarity": "和「垢」有共用部件或整體輪廓接近。",
        "difference": "先比較部首、外框與關鍵部件，確認「垢」的特徵：土字旁加上后，就是汙垢的垢。"
      },
      {
        "char": "坷",
        "similarity": "和「垢」有共用部件或整體輪廓接近。",
        "difference": "先比較部首、外框與關鍵部件，確認「垢」的特徵：土字旁加上后，就是汙垢的垢。"
      },
      {
        "char": "坂",
        "similarity": "和「垢」的部分筆畫或結構位置接近。",
        "difference": "先比較部首、外框與關鍵部件，確認「垢」的特徵：土字旁加上后，就是汙垢的垢。"
      },
      {
        "char": "城",
        "similarity": "和「垢」的部分筆畫或結構位置接近。",
        "difference": "先比較部首、外框與關鍵部件，確認「垢」的特徵：土字旁加上后，就是汙垢的垢。"
      },
      {
        "char": "后",
        "similarity": "和「垢」的部分筆畫或結構位置接近。",
        "difference": "先比較部首、外框與關鍵部件，確認「垢」的特徵：土字旁加上后，就是汙垢的垢。"
      },
      {
        "char": "詬",
        "similarity": "和「垢」的部分筆畫或結構位置接近。",
        "difference": "先比較部首、外框與關鍵部件，確認「垢」的特徵：土字旁加上后，就是汙垢的垢。"
      }
    ],
    "teachingTip": "土字旁加上后，就是汙垢的垢。"
  },
  "createdAt": "2026-09-17T15:54:11.675Z"
}
