{
  "taskType": "similar_shape",
  "requestId": "南一_2年級_上學期_第4課_similar_shape_a3946cfd908a84d9",
  "version": "1.0",
  "source": "chatgpt",
  "input": {
    "publisher": "南一",
    "grade": "2年級",
    "semester": "上學期",
    "lesson": "第4課",
    "targetChar": "芝",
    "lessonChars": [
      "塊",
      "圓",
      "形",
      "芝",
      "麻",
      "餅",
      "咬",
      "飯",
      "做",
      "課",
      "洗",
      "澡",
      "拾",
      "整",
      "包",
      "遊",
      "戲",
      "剩"
    ],
    "count": 6,
    "rule": "以字形相似為主：整體輪廓、共用部件、只差一兩筆、偏旁不同但主體相近。不要以同音或近義為主要依據。",
    "level": "國小中高年級"
  },
  "data": {
    "targetChar": "芝",
    "similarChars": [
      "之",
      "芒",
      "芳",
      "茂",
      "苓",
      "芙"
    ],
    "teachingTip": "芝上方是草字頭艹，下方是之；之沒有草字頭，其他草字頭的字要再看下半部。"
  },
  "createdAt": "2026-09-29T01:32:08.512Z"
}
