{"taskType":"similar_shape","requestId":"南一_1年級_上學期_首冊-統整_similar_shape_3d4930731e231086","version":"1.0","source":"chatgpt","input":{"publisher":"南一","grade":"1年級","semester":"上學期","lesson":"首冊/統整","targetChar":"七"},"data":{"targetChar":"七","similarChars":["匕","乜","也","切","比","宅"],"teachingTip":"注意『七』的橫畫和豎彎鉤位置；先看轉彎方向，再比較多出的筆畫。"},"createdAt":"2026-09-07T05:31:00.000Z"}
