{
  "taskType": "confusion_analysis",
  "requestId": "南一_6年級_上學期_第1課_confusion_analysis_ec98a39ab85f9ab7",
  "version": "1.0",
  "source": "chatgpt",
  "input": {
    "publisher": "南一",
    "grade": "6年級",
    "semester": "上學期",
    "lesson": "第1課",
    "char": "暈",
    "level": "國小中高年級"
  },
  "data": {
    "char": "暈",
    "groups": {
      "shape": [
        {
          "char": "軍",
          "why": "字形或部件相近",
          "difference": "比較「暈」與「軍」的部首、外框和關鍵筆畫。"
        },
        {
          "char": "暉",
          "why": "字形或部件相近",
          "difference": "比較「暈」與「暉」的部首、外框和關鍵筆畫。"
        },
        {
          "char": "揮",
          "why": "字形或部件相近",
          "difference": "比較「暈」與「揮」的部首、外框和關鍵筆畫。"
        }
      ],
      "sound": [],
      "meaning": [
        {
          "char": "暈",
          "why": "常用語詞是「暈眩」",
          "difference": "感到頭昏、站不穩。"
        }
      ],
      "component": [
        {
          "char": "日",
          "why": "組字提示",
          "difference": "辨認部件「日」在字中的位置。"
        },
        {
          "char": "冖",
          "why": "組字提示",
          "difference": "辨認部件「冖」在字中的位置。"
        },
        {
          "char": "車",
          "why": "組字提示",
          "difference": "辨認部件「車」在字中的位置。"
        }
      ]
    },
    "tip": "日下像有一輛車在轉，聯想到頭暈。"
  },
  "createdAt": "2026-09-17T15:54:11.675Z"
}
